id	title_en	keywords_en	authors	date	langue	translated
25520	Are researchers excluded from open data policies? Petition campaign directed to French tax services	spatial data,open data,land market,real estate market,cadastre,database	Boulay Guilhem,Buhot Clotilde,Fournier Jean-Louis	2012-09-26	fr	1
4895	Business networ	business networks,franchise,service,Spain,trade	Gámir Agustín,Méndez Ricardo	1999-05-17	en	1
4912	Vegetation mapping of South Corsica coastal area	coastal vegetation,mapping,natural ressource	Bioret Frédéric,Gourmelon Françoise	1999-07-06	fr	1
4917	La qualité des données de géomarketing	geomarketing,district level,grid,Rouen,modelling	Girault Frédéric,Orhan Jean-Marc	1999-07-12	fr	0
4925	A few remarks about urban geography in Japon since 1970	epistemology,history,japanese geography,urban geography	Onjo Akio	1999-09-24	fr	1
4930	Describing spatial patterns' profile : diversification measures	concentration,dispersion,heterogenity,homogeneity,job profiles	Novelli Eugenio,Occelli Sylvie	1999-10-04	it	1
4957	Prospective et gestion stratégique la réalité des délocalisations		Bouinot Jean	2007-03-09	fr	0
4958	Les cultures du privé et les choix de localisation		Bouinot Jean	2007-03-09	fr	0
4963	Non-metric conceptual clustering : a new tool for investigating urban quality of life (1) 	non-metric conceptual clustering,factor analysis,quality of life	Buckley Patrick H.,Mookherjee Debnath	1999-10-06	en	1
4959	Les facteurs de choix des localisations : les infrastructures de transport		Bouinot Jean	2007-03-09	fr	0
4960	Le coût d'opportunité des fonds publics		Bouinot Jean	2007-03-09	fr	0
4961	Les pôles de compétitivité : le recours au modèle des clusters ?		Bouinot Jean	2007-03-09	fr	0
4962	Mobiliser les externalités de savoir au service de développement local		Bouinot Jean	2007-03-09	fr	0
5227	Generalisation Model of urban datas	generalisation,GIS,multi-agent system,spatial analysis	Ruas Anne	1999-10-05	fr	1
4970	Urban transformation : the impact of urban planning at the city level The case of Boulogne-Billancourt and Issy-Les-Moulineaux	urban planning,real estate activity,comprehensive plan,redevelopment project,France,Boulogne-Billancourt,Issy-Les-Moulineaux	Burkart Marie	1999-10-27	fr	1
5006	Environmental disruptions in the Office of Niger area : evaluation and perspectives	office of Niger,irrigated perimeter,water management,breeding,fuel wood,environment degradation	Brondeau Florence	2004-03-24		1
4985	Spatial self-organization and the production of the city		Krafta Romulo	1999-03-24	en	1
4994	La struttura complessa delle citta. Un approccio cognitivo basato su reti neurali	cognitive approach,competitiveness,neural networks,urban complexity,urban sustainability	Buscema Massimo,Diappi Lidia	1999-05-26	it	0
4988	Les équipements culturels au service de la population des villes		Lucchini Françoise	1999-04-20	fr	0
5055	A methodology to investigate the effects of globalisation on local territorial structures	globalization,location factor,productive system,territorial organisation model	Lombardo Silvana,Santini Luisa	1999-06-16	fr	1
5064	Whole/Part logic bridge between the geographies	geography,epistemology,whole/part logic,axioms	Nicolas Georges	1999-06-16	fr	1
5068	4<sup>ème</sup> Rencontres ThéoQuant. Nouvelles approches en géographie théorique et quantitative, Besançon 11-12 février 1999			1999-06-16	fr	0
5069	Concepts used for multiple-resolution representations	multiple representation,semantic resolution,spatial data model,spatial resolution	Vangenot Christelle	1999-06-16	fr	1
5079	How is it possible to measure the homogeneity of an intra-urban structure?		Maïzia Mindjid	1999-06-16	fr	1
5081	Samples plans and field observation in teledetection		Laffly Dominique	1999-06-16	fr	1
5086	Which tools to study which geographical objects and for which aims ?		Arnaud Michel	1999-06-16	fr	1
5088	Représentation surfacique d'évènements ponctuels discrets. Comparaison méthodologique à partir de l'exemple des accidents de la route dans la C.U.D.L.	kernel density function,point pattern analysis,raster display,road accident	Banos Arnaud,Bolot Jérome	1999-06-16	fr	0
5095	Formalisation des bases méthodologiques et conceptuelles d'une analyse spatiale des accidents de la route		Richard Florence Huguenin	1999-06-16	fr	0
5101	Méthode d'identification de concentrations locales d'événements dans un semis de points. Application aux accidents de la route	analysis,exploratory analysis,cluster,geographical analysis machine,point pattern,road accident	Banos Arnaud,Huguenin-Richard Florence	1999-06-16	fr	0
5111	Resilience of a spatial system : the example of the Comtat	agriculture,diachronical approach,environment,resilience,spatial system,system’s analysis,the Comtat	Aschan-Leygonie Christina	1999-06-16	fr	1
5121	Contribution à l'approche systémique des paysages humides		Pivette Emmanuelle	1999-06-16	fr	0
5019	Cybergeo's Staff			2015-04-01	en	1
26057	Gorman-Murray A., Pini B., Bryant L. (eds.), 2013,		Blidon Marianne	2013-09-24	fr	1
5050	GenMNT : un outil simple pour la génération de modèles numériques de terrains	digital elevation model,interpolation,landscape modelling,triangulation	Poix Christophe,Sefiha E.	1999-02-10	fr	0
5034	Pour une géographie des milieux sonores	social geography,noise,landscape,sound	Roulier Frédéric	1999-01-21	fr	0
5043	Pour une approche de la cognition spatiale intra-urbaine	cognition,cognitive configuration,map,mental map,spatial cognition,survey technics,urban space	Cauvin Colette	1999-01-27	fr	0
5125	Concentration spatiale des accidents de la route : méthode d'identification des zones noires basée sur l'autocorrélation spatiale application et étude de sensibilité	black zone,road accident,spatial autocorrelation	Flahaut Benoît	1999-06-16	fr	0
5128	Network forms and accessibility	accessibility,fractal geometry,morphology,network	Genre-Grandpierre Cyrille	1999-06-16	fr	1
5131	Spatial analysis of rural outmigrations through patronimic diffusion	diffusion,gravity model,migration,patronimic,phone books,rural outmigrations	Assalin Sandrine	1999-06-16	fr	1
5140	Public infrastructures and growth in French regions		Charlot Sylvie,Schmitt Bertrand	1999-06-16	fr	1
5143	Towards the end of industrial suburbs ?		Dubos-Paillard Edwige	1999-06-16	fr	1
5145	Spatial analysis and geographical phenomena	cartography,chorematic,phenomenology,spatial analysis	Hangouet Jean-François	1999-06-16	fr	1
5151	Landscapes of mountain pastures. From teledetection to synthetic mapping. (Aspe en Ossau valleys in the Pyrenees )		Harguedinguy Muriel	1999-06-16	fr	1
5156	Les nouvelles perspectives d'analyse spatiale des nuisances sonores. Le projet SIGAUR (Système d'Information Géographique et Acoustique URbaine)	GIS,noise pollution,spatial decision support	Quesseveur Erwan	1999-06-16	fr	0
5163	Construire ses cartes : le développement d’outils statistiques interactifs intégrés à un SIG	bertin visual matrix,factor analysis,GIS,interactivity,spatial analysis tools	Ogier Benoît	1999-06-16	fr	0
5170	Natural risks in mountains and spatial analysis		Manche Yannick	1999-06-16	fr	1
5172	Modélisation des déplacements domicile/travail et des déplacements associés et des déplacements associés 	inter-municipalities trips,multi-ground trip,pairing,trip generator,trip sequence	Dumas Jean Renaud,Passegué Sophie,Hilal Mohamed	1999-06-16	fr	0
5185	Towards a “living atlas” . Use of GIS in industrial geography. An application to industry in Lorraine		Cheriguene Sadia	1999-06-16	fr	1
5187	Graphs and world graphics	geographical knowledge,graph,hypertext,writing	Gazel Hervé	1999-06-16	fr	1
5202	A simulation model for migration inside Basilicata region		Tamma Nicola	1999-06-16	fr	1
5207	Organisation et structuration de l'espace : &quot;les systèmes locaux d'emplois&quot;. L'exemple des Pyrénnées atlantiques		Bourguet Monique,Jambes Jean-Pierre	1999-06-16	fr	0
5215	Intercommunalité et territoires. Construction et expérimentation d'un modèle d'analyse du système		Vaivre Florence	1999-06-16	fr	0
5220	Mathematical formalization of basic geographical notions. From the time-space-matter to the geosystem		Langlois Patrice	1999-06-16	fr	1
5233	Borges, Carrol et la carte au 1/1		Palsky Gilles	1999-09-30	fr	0
5234	Demographic growth and spatial organisation : a representation in model form of active processes in Bolívar province, Ecuador	rural environment,demographic pressure,migration,graphic modelling,Ecuador,Bolívar Province	Pouyllau Michel,Poinsot Yves,Pouille Fabien	1999-02-02	es	0
5247	Un outil synthétique du suivi : la vision fréquentielle	cartography,image processing,space-frequency representation	Schneider Charles	1999-01-28	Fr	0
5251	Un exemple à l'échelle d'une ville : les bureaux à Stasbourg	Strasbourg,office,intra-urban location,spatial analysis	Goyer Annie	1999-01-27	fr	0
5257	Sirens within the IGU - an analysis of the role of women at International Geographical Congresses (1871-1996)	IGU,international congresses,scientific networks,woman	Robic Marie-Claire,Rössler Mechtild,UNESCO 	1996-12-14	fr	0
5265	Evaluation of natural surfaces in a dry tropical environment by remote sensing and ground survey 	area frame sampling,estimation of area,ground survey,land cover inventory,Mauritania,remote sensing	Godard Vincent	1996-12-17	fr	0
5277	Space and poverty	poverty,segregation,housing homelessness	Marpsat Maryse	1996-08-02	fr	1
5308	Les <em>mots justes</em><a class="footnotecall" id="bodyftn1" href="#ftn1">1</a> <a id="retour1"></a><a id="bkmretour1"></a>de Jean Gottmann		Muscara Luca	1998-03-26	fr	0
5370	LMD, proposition de plateforme commune des Départements et UFR de Géographie des universités d’Ile-de-France			2003-06-25	fr	0
5371	A new challenge for geographers		Arenas Federico	2000-11-20	fr	1
5826	Urban Densities and socio-residential organisation<br>Example of the urban area of Hamburg (Germany)	density models,factor analysis,intra-urban space,transformation,urban ecology	Meyer Anne-Marie	2003-08-02	en	1
5374	Les comportements spatiaux des entreprises en 2004. Les délocalisations entre mythes et réalités		Bouinot Jean	2005-03-29	fr	0
5367	Universités : courage fuyons !			2003-11-15	fr	0
5315	Some thoughts on cultural geography	cultural geography,epistemology	Collignon Béatrice	1998-04-07	fr	1
5316	The Symbolics of Place: A Geography of the Relationship Between Space, Power and Identity	America,geography,identity,place,power,space,symbol,symbolic	Monnet Jérôme	1998-04-07		1
5331	Géographie culturelle : remarques sur les remarques...		Guermond Yves	1998-05-22	fr	0
5332	La réception du modèle graphique de Burgess dans la géographie française des années cinquante aux années soixante-dix	graphic model,assimilation,Burgess,France,Chicago	Clerc Pascal,Garel Jacquemine	1998-05-22	fr	0
5342	Cyberspace - The Emerging Nervous System of Global Society and its Spatial Functions	cyberspace,global society,shrinking world	Bakis Henry,Roche E. M.	1998-05-28	en	1
5351	Des appareils photo jetables au service d´un projet de développement : représentations paysagères et stratégies des acteurs locaux de la montagne thiernoise		Michelin Yves	1998-12-07	fr	0
5354	10th Colloquium on Theoretical and Quantitative Geography, Rostock, Germany, September 6-11th, 1997			1997-09-06		0
5432	Pour une nouvelle approche spatiale de l´exclusion sociale	exclusion,territory,social theory,spatial theory	Mathieu Nicole	1997-10-24	fr	0
5377	Réalignements partisans face à la construction européenne		Bussi Michel,Colange Céline,Gosset Jean-Paul	2005-06-03	fr	0
5509	Commentaires sur l´estimation de la population légale par le recensement rénové de la population..		Courgeau Daniel	1999-12-20	fr	0
5479	La géographie doit-elle encore servir à justifier l’exclusion ? Comment une vision archaïque de la Géographie induit la définition de l’Europe dans le traité constitutionnel ?		Verdier Nicolas	2005-06-01	fr	0
5431	La prise en compte des dynamiques spatiales pour modéliser la mise en valeur des espaces ruraux	rural areas,process,spatial dynamic,GIS	Gautier Denis	1997-04-09	fr	0
5383	A propos de la canicule… Aléa et vulnérabilité		Caseau Paul	2003-09-12	fr	0
5385	Au sujet des transformations cartographiques de position	cartography	Cauvin Colette	1997-01-14	fr	0
5387	Big Cities Blues: myth or reality ?	big city,catastrophism,image,megapolis,representation	Monnet Jérôme	1997-02-18	fr	1
5394	PHD in Geography : France from 1872 till 1972	France,geography,history of geography,Phd	Briend Anne-Marie,Joseph Bernadette	1997-03-21	fr	1
5399	Liste chronologique des principaux périodiques français de géographie 	journal,geography,France	Joseph Bernadette	1997-03-21	fr	0
5402	Contacts			2007-05-25	fr	0
5404	Une canicule politique		Gaudin Jean-Pierre	2003-11-24	fr	0
5406	Exclusion, retrocession...from the " Programme des dames " to " men only "		Robic Marie-Claire	1997-04-04	fr	1
5407	Contact			2007-05-25	en	1
5480	Les leçons d'un &quot;non&quot; multiscalaire		Elissalde Bernard	2005-06-02	fr	0
5481	Enjeux européens et réalignements locaux : les élections européennes de juin 2004 en France.		Colange Céline	2004-09-16	fr	0
5416	Geographical studies of the school and geographical education at school. (Five years of PhD thesis in France.)	education,Phd,school,teaching	Chevalier Jean-Pierre	1997-04-09	fr	1
5417	A data base on French thesis in geography	database,France,geography,history of geography,place,thesis	Joly Gérard	1997-03-25	fr	1
5439	Territoire et exclusion : des mots de l´Etat-providence et des maux de la société civile 	social exclusion,social polarisation,social integration,urban segregation,residential segregation,welfare policy,post-industrial metropole,urban society	Rhein Catherine	1997-10-24	fr	0
5454	Apartheid et Israël-Palestine : enseignements et contresens d’une analogie		Giraut Frédéric	2004-11-15	fr	0
5466	Comparaison n'est pas raison…		Guermond Yves,Mathieu Nicole	2004-11-15	fr	0
5467	About the place of Geography in the field of Indian Social Sciences		Oliveau Sébastien	2006-03-30	fr	1
5468	2003, Combien de femmes au CNU ?		Pumain Denise	2003-11-24	fr	0
5482	Nouvelles centralités en périphérie		Gentelle Pierre	2005-04-11	fr	0
5529	La rénovation du Recensement de la Population		Isnard Michel	1999-07-15	fr	0
5531	Quand l’INSEE projette d’enterrer le recensement de population... et la Géographie avec !		Bussi Michel	1999-06-20	fr	0
5532	Making allowances for spatial and network effects when assessing indicators on infrastructure network nodes	accessibility,centrality,Delaunay triangulation,graph,indicators,network,path,spatial structure	Gleyze Jean-François	2007-04-15	fr	1
5537	Let's suppress geography !		Rimbert Sylvie	1998-05-15	fr	1
5534	Should geography withdraw from high school ?		Le Roux Anne	1999-05-11	fr	1
5538	Should geography be erased ?		Pumain Denise	1998-05-01	fr	1
5539	La preuve apportée par les sciences			1997-04-04	fr	0
5563	La richesse invisible		Pumain Denise	2007-02-25	fr	0
5564	Hidden Riches		Pumain Denise	2007-03-27	en	1
5565	Ambulantage et métropolisation	ambulantism,metropolization,mobility,urban mobility,public space	Monnet Jérôme	2007-04-21	fr	0
5561	Photographies des participants du Congrès de Géographie qui s'est tenu à Paris en 1931		Boisselot J.	1996-08-08		0
5827	Les principaux enseignements du 1<sup>er</sup> tour de l’élection présidentielle de 2007 en cartes		Leroy Stéphane	2007-04-30	fr	0
5554	The use of distributed artificial intelligence techniques to investigate the roles of Cartesians and stochasts in cooperative problem solving	distributed artificial intelligence,simulation,agents	Jeffrey Paul	1997-03-26	en	1
5556	Une remarque sur la permanence des systèmes spatialisés 		Franc Alain	1997-04-10	fr	0
5574	Street Trade and Mobility Services : the Crossroads in Mexico City	ambulantism,urban mobility,metropolization,informal trade,street vending,crossroad,traffic,services to travellers,Mexico City	Monnet Jérôme,Giglia Angela,Capron Guénola	2007-04-06	fr	1
17762	Automobile dependency, tension in the mobilities and households strategie	activity pattern,automobile dependency,automobile speed,travel-time budget,urban sprawl,“rational locator”.	Genre-Grandpierre Cyrille,Josselin Didier	2008-04-23	fr	1
5591	Ambulantaje in images: A history of street commerce representations in Mexico City (XVIIIth- XXth centuries)	ambulantism,history,metropolization,Mexico City,public space,representation,street commerce	Alba Martha De,Exbalin Arnaud,Rodríguez Georgina	2007-04-19	es	1
6281	‘On the Front Page’ – and Behind the Front Page, Quality! And New Releases		Kosmopoulos Christine,Pumain Denise	2007-06-04	en	1
5607	The Spatial Influence of the Tunisian Cities through the diffusion of innovative multiplant firms	companies network,influence,proximity,spatial diffusion,spatial dynamic,Tunisia,urban hierarchy,urban system	Belhedi Amor	2007-04-16	fr	1
5615	Impact of migration, natural population change and age composition on the redistribution of the population in Sweeden 1970 - 1996 	population redistribution,Sweden,concentration,dispersion,migration,natural population change,age composition	Håkansson Johan	2000-02-29	en	1
5626	Modeling the commuting trips in peri-urban environment : the case of the region of Lyon		Schéou Bernard	1998-05-26	fr	1
6302	Crédits			2007-05-31	fr	0
6351	Credits			2007-05-31	en	1
6407	Atlas of South India - 1991	atlas,India,demography	Oliveau Sébastien	2005-03-26	en	1
6498	A geographical knowledge organised around four poles	academic geography,applied geography,general public geography,school geography	Chevalier Jean-Pierre	1997-04-08	fr	1
6547	Remote sensing, digitalisation and scale change in the study of natural and urban environment	remote sensing	Callot Yann,Drouot Jean-Louis	2000-04-25	fr	1
6561	Research in rural areas decollectivization in PECO	remote sensing	Sivignon Michel,Gilg Jean-Paul	2000-05-05	fr	1
5633	The Eurovision song contest and the cultural frontiers in Europe	cultural geography,Europe,European Union,frontier,minorities	Venon Fabien	2007-01-23	fr	1
5639	Revue des sommaires/Journal Reviews			2007-04-24	fr	0
15973	Which "prospect" between Moscow and St Petersburg? A study about a road	planning of the land,transportation,cartography,Russia	Issaev Dimitri	2008-02-12	fr	1
5641	Redécoupage des limites régionales, ou coopération interrégionale ? Le cas de la Bretagne		Guigou Jean-Louis	2007-04-18	fr	0
6022	French Election, 2007		Colange Céline	2007-05-15	fr	1
6225	The impact of gated Communities on property values: evidence of changes in real estate markets -Los Angeles, 1980-2000	gated communities,housing prices,property values,real-estate market,urban development	Le Goix Renaud	2007-05-16	en	1
6288	Sous la page, la qualité ! et les nouveautés…		Pumain Denise,Kosmopoulos Christine	2007-05-31	fr	0
7184	Cybergeo's audience		Pumain Denise	1999-05-12	en	1
7191	Reinvent Geodiversity		Pumain Denise	1999-12-12	en	1
7198	Printemps de la modélisation		Pumain Denise	2000-03-12	fr	0
7205	Marche forcée vers le marché		Pumain Denise	2000-10-12	fr	0
7212	Research and Transmission		Pumain Denise	2001-01-12	en	1
7219	Science and patience		Pumain Denise	2001-06-12	en	1
7472	Modelling in Geography		Pumain Denise	2000-03-12	en	1
7482	In the Middle of the World: the Center and its Networks		Pumain Denise	2001-10-12	en	1
7492	Criminality in Maputo, Mozambique : origin, spatial distribution and repercussions	Mozambique,Maputo,criminality,feeling of insecurity,socio-residential organisation,public police force,private security company,self-defence,community police	Folio Fabrice	2007-07-02	fr	1
7722	Spatial characterization of flood hazard using SAR images	flood hazard,spatial characterization,RADAR remote sensing,digital elevation model (DEM),data matching,hydraulic coherence	Hostache Renaud,Puech Christian,Raclot Damien	2007-07-06	fr	1
7872	Retail Market Analysis within the Quebec Metropolitan Area: a Methodological Approach Combining Travel Survey with GIS	GIS,market area,retail,spatial analysis,travel behaviour,competition among shopping facilities,Quebec	Biba Gjin,Thériault Marius,Des Rosiers François	2007-07-09	fr	1
8002	Détermination d’une ligne de rivage de grande taille à l’aide de la multi résolution hiérarchique sur une image RSO	radar image,coastline,multiresolution,edge detection,mathematical morphology	Akono Alain,Tonyé Emmanuel,Passo Marie-Madeleine Djougo,Tankam Narcisse Talla,Dzepa Charly	2007-07-11	fr	0
8142	Lieu de résidence réel et lieu de résidence idéal : une approche fondée sur la théorie de la décision	residential choice,decision,subjective expected utility,evaluation,social groups	Meyer Anne-Marie	2007-07-11	fr	0
8212	Descriptors generation from very high spatial resolution satellite images	descriptors,eliciting,high resolution images,morphological segmentation	Lopez-Ornelas Erick,Sèdes Florence	2007-07-11	fr	1
8322	Urban Ontologies for an improved communication in urban civil engineering projects	modelling,ontology design,urban planning,interoperability,information system,XML	Teller Jacques,Keita Abdel Kader,Roussey Catherine,Laurini Robert	2007-07-11	en	1
8462	Detecting Clusters in Spatially Repetitive Point Event Data Sets	Geo-ProZone analysis,point event data,robust normalisation,spatial clustering,spatial repetition	Brimicombe Allan	2007-07-11	en	1
12581	Developing countries rural houses automatic extraction from Very High spatial Resolution (VHR) remote sensing data	housing,rural area,VHR images,spatial approach	Devaux Nicolas,Fotsing Jean-Marie,Chéry Jean-Pierre	2007-07-12	fr	1
8692	Analyse géographique et modélisation des dynamiques d’urbanisation à La Réunion	geographical field,Réunion island,spatial model,urban dynamics	Thinon Pascal,Martignac Cécile,Metzger Pascale,Cheylan Jean-Paul	2007-07-16	fr	0
8812	Service de capitalisation et diffusion de connaissances		Baron Vincent,Griset Hélène	2007-07-16	fr	0
8902	Fractal Analysis of the Urbanization at the Outskirts of the City: Models, Measurement and Explanation	fractal dimension,urbanization,outskirts,Thessaloniki	Lagarias Apostolos	2007-07-16	en	1
8962	Artificial intelligence and collective agents: the EUROSIM model	citie,Europe,multi-agent system,collective agents,multiscalar analysis	Sanders Lena,Favaro Jean-Marc,Mathian Hélène,Pumain Denise,Glisse Benoît	2007-07-16	fr	1
9052	Towards an individual-based approach to modelise and simulate spatial patterns of a communicable disease : the plague in Madagascar	pathogenic system,complex,plague,Madagascar,multi-agent modelling	Badariotti Dominique,Banos Arnaud,Laperrière Vincent	2007-07-16	fr	1
9262	Use of topological functions of landscape for cost-distance computation	cost distance,edge,habitat,resistance,spread,water vole	Foltête Jean-Christophe,Berthier Karine,Cosson Jean-François	2007-07-18	fr	1
9272	Deployment of interactive atlases on Internet : new avenues with Scalable Vector Graphics, C# and ASP.Net	atlas,geovizalisation,interactive cartography,SVG,web cartography,web-map	Apparicio Philippe,Petkevitch Valera	2006-06-26	fr	1
22341	On the recuperation of postindustrial sites: an aesthetic analysis 	restoration,transformation,renovation,postindustrialsites,environmental aesthetics	Maskit Jonathan	2009-12-17	en	1
22347	The emergence of metropolitan policies in Marseilles: between conflict and learning	Marseilles,urban planning,metropolitan project	Douay Nicolas	2009-05-25	fr	1
11203	Cross-product statistics for exploratory analysis of spatial dependence	cross-product statistics,decision making assistance,exploratory spatial analysis,hot-spot analysis,local indicators of spatial autocorrelation,Mantel test,spatial autoregression,spatial dependency,spatio-temporal interactions	Zaninetti Jean-Marc	2007-08-22	fr	1
11373	Point-to-point on-demand transport in rural areas. A route optimisation method	Demand Responsive Transport,Dial a Ride,DRT,operations research,pickup and delivery,vehicle routing	Garaix Thierry,Josselin Didier,Feillet Dominique,Artigues Christian,Castex Élodie	2007-07-20	fr	1
9942	The Semantics of the Web		Pumain Denise	2007-09-10	en	1
9952	Some explanations about Michel Butor’s relashionship with geography. Discussion with Michel Butor		Gobenceaux Nathanaël	2007-09-12	fr	1
10182	Residential segregation in the largest French cities (1968-1999): in search of an urban model	France,gentrification,model,residential segregation,social geography,urban space	Schwabe Markus	2007-09-19	fr	1
24601	Residential segregation in the largest French cities (1968-1999): in search of an urban model	urban space,social geography,model,residential segregation,gentrification,France	Schwabe Markus,Verdier Angéla	2011-10-22	en	1
9992	Amilhat-Szary A-L, Fourny M.-C. (dir.), 2006, Après les frontières, avec la frontière, Nouvelles dynamiques transfrontalières en Europe, Editions de l’Aube, La Tour d’Aigues, 170 p.		Buxeda Cécile	2007-09-12	fr	0
11133	The storm that rocks the boat: the systemic impact of gated communities on urban sustainability	urban sustainability,sustainable development,gated communities,impact assessment,systemic approach,systems thinking	Landman Karina	2007-09-19	En	0
10993	Conceiving a graph-based non-stationary cellular automata to model the urban spatial structure: the Remus model	cellular automata,graph,modelling,neighbourhoo,network,urban	Badariotti Dominique,Banos Arnaud,Moreno Diego	2007-10-03	fr	1
10913	Questioning sustainable development	environment,equitability,planning,resource,scales of action,territorial policies	Mancebo François	2007-10-09	fr	1
15633	Valeurs géographiques, valeurs de la géographie		Pumain Denise	2007-12-20	fr	0
