id	title_en	keywords_en	authors	date	langue	translated
22818	Spatial analysis of C. Gigas proliferation in Brittany (France)	biogeography,Brittany,coastal zone,Crassostrea gigas,GIS,global change,invasive species,oyster	Le Berre Iwan,Hily Christian,Lejart Morgane,Gouill Raphaël	2009-12-08	fr	1
22846	David Harvey, 2008, Géographie de la domination, Paris, Les Prairies Ordinaires, 118 p.		Boichot Camille	2009-12-15	fr	0
22848	Jérôme Dubois J., 2009, <em>Les politiques publiques territoriales. La gouvernance multi-niveaux face aux défis de l’aménagement</em>. Presses Universitaires de Rennes, 216 p.		Gaudin Jean-Pierre	2009-12-16	fr	0
22849	Usability evaluation for a web-based public participatory GIS: A case study in Canmore, Alberta	multicriteria site selection analysis,usability evaluation,Web-PPGIS	Meng Yunliang,Malczewski Jacek	2009-12-17	en	1
23171	Les figures du pouvoir à Harbin pendant la « Guerre de quinze ans » (1931-1945)		Breuillard Sabine	2010-07-26	fr	0
22858	, Centro Nacional de Informacion Geografica, Madrid, 387 p.		Verdier Nicolas	2009-12-17	fr	0
22861	Desse R.-P., Fournié A., Gasnier A., Lemarchand N., Metton A. et Soumagne J. (dir.), 2008, <em>Dictionnaire du commerce et de l’aménagement</em>, Rennes, PUR, 357 p.		Fleury Antoine	2009-12-22	fr	0
22860	Humphreys Laud, 2007, <em>Le commerce des pissotières. Pratiques homosexuelles anonymes dans l’amérique des années 1960</em>, Paris, La découverte.		Blidon Marianne	2009-12-17	fr	0
22862	JournalBase - A Comparative International Study of Scientific Journal Databases in the Social Sciences and the Humanities (SSH)	bibliometry,humanities,science assessment,social sciences	Dassa Michèle,Kosmopoulos Christine,Pumain Denise	2010-01-08	en	1
22869	Urban trends and changes in the open spaces in Languedoc-Roussillon (France)	agriculture,land use,periurban area,spatial analysis,urban sprawl	Abrantes Patricia,Soulard Christophe,Jarrige Françoise,Laurens Lucette	2010-01-13	fr	1
22881	Beninese’s Contribution to Geography	Beninese geography,development,epistemology,geographic thought,inductive or deductive approach,thesis	Agossou Noukpo	2010-01-19	fr	1
22964	Towards the implementation of a collective action for managing natural coastal risk in France	coastal defenses,collective action,France,Integrated Coastal Zone Management (ICZM),natural disasters,natural risks,stakeholders	Deboudt Philippe	2010-03-03	fr	1
22902	The geographical dilemma of social democrat parties: the example of socialist parties in Belgium	geographical heterogeneity,political attitude,social democrat parties,social supervision	Hamme Gilles Van	2010-02-03	fr	1
22930	Telecommunication networks and local development policy. Heading toward a “territorial digital divide 2.0”?		Moriset Bruno	2010-02-16	fr	1
22864	JournalBase - A Comparative International Study of Scientific Journal Databases in the Social Sciences and the Humanities (SSH)		Dassa Michèle,Kosmopoulos Christine,Pumain Denise	2010-01-08	fr	1
22957	Grand Baie (Mauritius island): shown side and hidden side	Mauritius,Grand Baie,touris,urbanization,environment,development	Jauze Jean-Michel	2010-03-03	fr	1
22976	Looking for network effects in Schelling’s model of segregation	agent-based simulation,networks,Schelling’s model,segregation	Banos Arnaud	2010-03-09	fr	1
22981	How Élisée Reclus became an atheist. A new biographic document	Dordogne,GARF,Mečnikov,Reclus,Ritter	Ferretti Federico	2010-03-16	fr	1
22999	Predicting and mapping the location of an estimated population from a survey: an applied method	elderly,GIS,health,mapping,survey,wellbeing	Gerber Philippe,Fleuret Sébastien,Schneider Marc	2010-03-22	en	1
23009	The notion of belt in the French geography of the United States as taught at school	Belts,epistemology,geography at school,models in geography,regionalisation,United States	Wastable Marielle	2010-04-14	fr	1
23144	“Reshaping Economic Geography”: The World Bank Report arrangements with urban geographical sciences	concentration,development,geography and economy,measure,metropolitanization,urbanization	Moriconi-Ebrard François,Denis Eric,Marius-Gnanou Kamala	2010-05-20	fr	1
23008	Démographie et mouvement		Terrier Christophe	2010-03-24	fr	0
23015	La Chine : interrogations sur un avenir		Gentelle Pierre	2010-04-14	fr	0
23017	The impact of the opening of the breach in the Langue de Barbarie (Saint-Louis du Senegal) in 2003: a change of flood hazards nature?	Senegal,Saint-Louis,Barbary Tongue,estuary,breach,hydrological regime,flood event,marine flooding,sea level rise,modelling	Durand Paul,Anselme Brice,Thomas Yves-François	2010-04-27	fr	1
23051	Bataillon C., 2009, <em>Géographes Génération 1930</em> <em>(à propos de Roger Brunet, Paul Claval, Olivier Dollfus, François Durand-Dastès, Armand Frémont et Fernand Verger)</em>. Rennes, PUR, Collection "Espace et Territoires", 226 p.		Pumain Denise	2010-04-22	fr	0
23052	Is it necessary to abandon ZNIEFF data base?	biodiversity,cartography,country planning,democracy,equity,GIS,Znieff	Couderchet Laurent,Amelot Xavier	2010-05-05	fr	1
23068	The world development report of the World Bank: an illusionary change of paradigm	development,new economic geography,agglomeration,macro-regional integration	Hamme Gilles Van,Van Criekingen Mathieu,Lennert Moritz	2010-04-26	fr	1
23076	Philcarto : histoire de vie d’un logiciel de cartographie	software,programming,cartography,statistics,evaluation,publication	Waniez Philippe	2010-05-03	fr	0
23091	Which values for urban renewal?	city,Dunkerque,Lille,Marseilles,representation,storytelling,urban regeneration,values	Tiano Camille	2010-05-03	fr	1
23131	Make them walk ! Simulating pedestrian movement in dynamic environments	agent-based model,architecture,pedestrian movement,planning,simulation	Banos Arnaud,Charpentier Angèle	2010-05-17	en	1
23142	Kanevski M., Pozdnoukhov A. and Timonin V., 2009, <em>Machine Learning for Spatial Environmental Data : theory, applications and software</em>, EPFL Press, 2009, 377 p.		Pumain Denise	2010-05-14	fr	0
23143	Sivignon M., 2009, <em>Les Balkans. Une géopolitique de la violence</em>. Belin, Paris 2009, 208 p.		Chamussy Henri	2010-05-14	fr	0
23152	Farmers networks in favor of the environment in France	agriculture,landscape protection,multifunctionality,pollution,representation,sustainable development,water	Laurent François,Vieira Medeiros Rosa	2010-05-19	fr	1
23155	Types of climates on continental France, a spatial construction	cartography,climate typology,on line data base,quantitative approach	Joly Daniel,Brossard Thierry,Cardot Hervé,Cavailhes Jean,Hilal Mohamed,Wavresky Pierre	2010-06-18	fr	1
26895	Introduction to GeoOpenMod		Banos Arnaud	2014-10-10	en	1
26896	Débarre S. (dir), 2014, Géographies entre France et Allemagne - Acteurs, notions et pratiques (fin XIXe siècle - milieu XXe siècle), Revue Germanique Internationale, No.20, 212 p.		Ferretti Federico	2015-03-18	fr	0
26897	Terrin J.-J. (dir.), 2014, Villes inondables, Prévention, adaptation, résilience, Marseille, Parenthèses, 288 p.		Plattard Odile	2015-03-19	fr	0
26899	Is cities delineation a pre requisite for urban modelling? The example of land price determinants in Brussels	hedonic prices,cities delineations,Brussels	Jones Jonathan,Peeters Dominique,Thomas Isabelle	2015-03-30	en	1
23242	Paquot Th., 2009, <em>L’espace public</em>, Paris, La Découverte, coll. Repères, 125 p.		Fleury Antoine	2010-08-30	fr	0
23172	Veschambre V., 2008, <em>Traces et mémoires urbaines. Enjeux sociaux de la patrimonialisation et démolition</em>, Rennes, PUR, 315 p.		Salin Marion	2010-06-09	fr	0
23225	Les émissions de CO<sub>2</sub> et autres gaz à effets de serre	geopolitics,globalization,greenhouse gases,Kyoto protocol	Durand-Dastès François	2010-07-20	fr	0
23175	Modeling historical objects based on social use, space and time in order to study urban dynamics in large time span	city,geographical information system,historical sciences,modelling,space,space-time,spatial dynamics,time,urban function	Rodier Xavier,Saligny Laure	2010-06-17	fr	1
23187	The greenways planning, from global to local: realities and limits	Greenway,intercommunality,peri-urban,public policies,regulation,territory planning,urban dynamics,urbanism	Cormier Laure,Lajartre Arnaud Bernard De,Carcaud Nathalie	2010-07-06	fr	1
23183	Performances of the ozone determinist modellings at mesoscale and at microscale in the Alpes-Maritimes	atmospheric pollution,forecast,local scale,meteorology,modelling,validation	Martin Nicolas	2010-06-17	fr	1
23201	<em>Nourrir les hommes. Un dictionnaire</em>, 2009, Paris, Éditions Atlande, 765 p.		Dupuy Gabriel	2010-07-08	fr	0
23202	Eco-neighborhoods: laboratories for the sustainable city. Paradigm shift or eternal return of the same?	critical geography,eco-neighborhood,sustainable urbanism	Bonard Yves,Matthey Laurent	2010-07-09	fr	1
23231	The spatial dynamics of gentrification in Paris. A synthesis map	gentrification,social filtering up,social divisions of space,spatial dynamics,frontier,cartography,working-class neighbourhoods,Paris.	Clerval Anne	2010-07-20	fr	1
23243	Orain O., 2009, <em>De plain-pied dans le monde, écriture et réalisme dans la géographie française du XXe siècle</em>. Paris, L’Harmattan, Histoire des sciences humaines, 427 p.		Bataillon Claude	2010-08-30	fr	0
23244	Coutard O., Lévy J.-P. (dir.), 2010, <em>Ecologies urbaines</em>, Paris, Economica-Anthropos, 371 p.		Dupuy Gabriel	2010-08-30	fr	0
23305	Did the flowering of the La Tolita culture 3000 BP result from a natural disaster?	cultural development,Ecuador,La Tolita,natural disaster	Dumont Jean François,Valdez Francisco,Santana Essy,Tihay Jean Pierre,Usselmann Pierre,Navarrete Edison	2010-10-11	en	1
23253	From planning to care: the Loire catchment basin as a mirror of the evolving relationship between fluvial development and environment	dam,environment,flood hazard,hydrosystem,Loire basin,natural hazard,planning,prevention,protection	Rode Sylvain	2010-09-22	fr	1
23273	Anglade G., 2008, <em>Chronique d'une espérance. L'hebdo de Georges Anglade (2007-2008),</em> Port-au-Prince, L'Imprimeur II, Collection Livres en folie, 104 p.	demographic transitions,geography of development,Haiti,misery,peasant,poverty,social geography,social shifts	Prévil Carlo	2010-09-28	fr	0
23303	Deboudt Ph. (dir.), 2010, <em>Inégalités écologiques, territoires littoraux et développement durable</em>, Villeneuve d’Ascq, Presses universitaires du Septentrion, 409 p.		Gueben-Venière Servane	2010-09-30	fr	0
23319	An estimation of Chinese cities population based on built-up areas	built-up areas,China,cities,remote sensing,system of cities	Swerts Elfie,Pumain Denise	2010-10-14	fr	1
23324	The new territories of tourism in Egypt: a local-global frontier?	Egypt,globalisation,hotels,industry,international brands,state,territory,tourism	Vignal Leïla	2010-10-29	en	1
23336	Garnier J.-P., 2010, <em>Une violence éminemment contemporaine. Essais sur la ville, la petite bourgeoisie intellectuelle et l’effacement des classes populaires</em>, Marseille, Agone, coll. Contre-Feux, 254 p.		Clerval Anne	2010-10-30	fr	0
23337	Global services, local geographies: producer services in London and Paris	advanced producer services,global city-regions,London,Paris	Halbert Ludovic,Pain Kathy	2010-11-19	fr	1
23369	Urban fragmentation politics and violence, the case of Kingston, Jamaica.	Kingston,Jamaica,segregation,geopolitics,culture,comparison,Willy Linch syndrom	Cruse Romain	2010-11-25	fr	1
23362	Guérin-Pace F. et Filippova E. (dir.), 2008, <em>Ces lieux qui nous habitent. Identité des territoires, territoires des identités</em>, La Tour d’Aigues, Editions de l’Aube		Debarbieux Bernard	2010-11-17	fr	0
23380	Tous géographes !		Pumain Denise	2010-12-01	fr	0
23381	An agent-based model of residential patterns and social structure in urban areas	agent-based modelisation,location choice,social segregation,transport time,urban economics	Lemoy Rémi,Raux Charles,Jensen Pablo	2010-12-06	en	1
23387	All are geographers!		Pumain Denise	2010-12-01	en	1
23388	Analysis of climate variability and of its influences on seasonal rainfall regimes in West Africa: case of the N’zi (Bandama) watershed in Ivory Coast	climate variability,Ivory Coast,N’zi-Bandama,rainfall regimes	Kouassi Amani Michel,Kouamé Koffi Fernand,Koffi Yao Blaise,Dje Kouakou Bernard,Paturel Jean Emmanuel,Oulare Sekouba	2010-12-07	fr	1
23405	Borders and scales: the challenges of a cross-border bridge between French Guiana and Brazil	border,geographical scale,bridge,French Guiana,transport networks	Boudoux d’Hautefeuille Madeleine	2010-12-15	fr	1
23402	Lieber M., 2008, <em>Genre, violences et espaces publics. La vulnérabilité des femmes en question</em>, Paris, Presses de Sciences-Po.		Olmedo Elise	2010-12-09	fr	0
23412	Note to Authors			2010-02-03	en	1
23431	Varlet J. et Zembri P. avec Eugénie Dumas et Jules Grandin (cartographes), 2010, <em>Atlas des transports – Les paradoxes de la mise en réseau du monde</em>, Paris, Éditions Autrement, 79 p.		Dobruszkes Frédéric	2011-01-03	fr	0
23433	« T-Sphere » and mediance space/range : contradictory antagonism and the concept of geoanthroposystem.	contradictory antagonist logic,cybernetic,enaction,fractality,geoanthroposystem,mediance,neoteny,space/range,sphere,transduction	Reymond Henri	2011-01-10	fr	1
23451	Neighbourhood impact on votes awarding in the Eurovision Song Contest	social network,spatial neighbourhood graph,clustering,Eurovision Song Contest	Gleyze Jean-François	2011-01-10	fr	1
23461	The Map of the Western Spanish Africa of 1949 to scale 1:500.000: military pride, méharés and poetical saharawi games	cartography,colonialism,Africa,topography	Esteban José Antonio Rodriguez	2011-01-20	es	1
23459	Lacoste Y., Lorot P., 2010, <em>La géopolitique et le géographe. Entretiens avec Pascal Lorot</em>, Paris, Choiseul Éditions, 268 p.		Commenges Hadrien	2011-01-10	fr	0
23464	Poupeau F., François J.-C., 2008, <em>Le sens du placement. Ségrégation résidentielle et ségrégation scolaire, Paris</em>, Raisons d’Agir, 229 p.		Boularan Zoé	2011-01-18	fr	0
23467	Élisée Reclus and the Jews : a geographical study of a stateless people	anarchism,anti-semitism,Jews,Reclus,universal geography	Ferretti Federico,Malburet Philippe,Pelletier Philippe	2011-02-02	fr	1
23476	Hänsgen D., Lentz S. et Tzschaschel S. (dir.), 2010, <em>Deutschlandatlas. Unser Land in 200 thematischen Karten</em>, Primus Verlag, Darmstadt, 240 p.		Laporte Antoine	2011-01-27	fr	0
23477	Is there a New Socialist Geography in Venezuela? Spatial Justice and Social Justice in the Hugo Chavez Bolivarian Revolution		Fournier Jean-Marc	2011-02-25	fr	1
23491	Dumont M., Hellier E., 2010, <em>Les nouvelles périphéries urbaines : formes, logiques et modèles de la ville contemporaine,</em> Rennes, Presses universitaires de Rennes, 218 p.		Matthey Laurent	2011-02-24	fr	0
23494	Ecological network: Utilisation of the land use maps in a first qualitative approach of the biodiversity	biodiversity,ecological corridors,GIS,landscape,management and planning,spatial analysis	Liénard Sandrine,Clergeau Philippe	2011-03-01	fr	1
23502	Analysis of value added per capita: a taxonomy of Italian local labour market systems through the shift-share analysis with spatial structure.	Italy,Jacobs’ externalities,local labour market,shift share analysis,spatial analysis	Pasquariello Massimo	2011-03-17	it	1
23520	Governance in the field of European spatial planning: europeanization at stake. Proposals for an analysis in the framework of the European Spatial Observatory Network (ESPON).	europeanization,spatial concept,governance,territorial governance,spatial planning,European Union,European Spatial Observatory Network (ESPON)	Bonerandi Emmanuelle,Santamaria Frédéric	2011-03-18	fr	1
23513	Innovative cluster: conceptualization and spatial implementation	Innovative cluster,proximity,networks,public policy,economic and spatial development	Leducq Divya,Lusso Bruno	2011-03-07	fr	1
23530	Governance in the field of European spatial planning: europeanization at stake. Proposals for an analysis in the framework of the European Spatial Observatory Network (ESPON).	European Spatial Observatory Network (ESPON),European Union,europeanization,governance,spatial concept,spatial planning,territorial governance	Bonerandi Emmanuelle,Santamaria Frédéric	2011-03-18	fr	1
23531	The Contribution of Urban and Regional Planning to Climate Change Mitigation	climate change,density,energy,urban and regional planning	Desjardins Xavier	2011-03-22	fr	1
23537	Abandoned sites: urban voids of the megacity The impact of interim use of abandoned sites on the hydrological situation in Guangzhou, China	abandoned sites,groundwater,Guangzhou,interuse,mega-urbanization	Wiethoff Katharina,Baier Klaus,Strohschön Ramona	2011-03-23	de	1
23555	When the hazard becomes the resource: block and sand mining around Merapi volcano (Indonesia) in risk studies	Merapi volcano,resources,risk,volcanic deposits,vulnerability	Bélizal Édouard de,Lavigne Franck,Grancher Delphine	2011-03-23	fr	1
23564	The furnished rental sector in Paris and its inner suburbs: metamorphosis of a tenure	furnished rental sector,housing,Paris real‑estate market,rental market	Trouillard Emmanuel	2011-03-23	fr	1
23596	Perceptions, Local Reorganizations and Strategies of Actors Following to the Implementation of an European Agricultural Policy. Study of the French rural development program in Thymerais, Monts de Lacaune, Pays de Langres, Mené, Coteaux du lyonnais, southern Ardèche	Common Agricultural Policy (CAP)	Tchékémian Anthony,Suchet André	2011-03-30	fr	1
23598	Perceptions, Local Reorganizations and Strategies of Actors Following to the Implementation of an European Agricultural Policy. Study of the French rural development program in Thymerais, Monts de Lacaune, Pays de Langres, Mené, Coteaux du lyonnais, southern Ardèche	Common Agricultural Policy (CAP)	Tchékémian Anthony,Suchet André	2011-03-30	fr	1
24646	A metaphor of the geographical approach and the XIXth century history: Mysterious Island of Jules Verne (1874-75)	Extraordinary Journeys,geographical imaginary,Jules Verne,metaphor,Mysterious Island	Dupuy Lionel	2011-10-18	fr	1
24658	PPR, urbanization and forest fire risks in Pyrénées-Orientales department: methods, issues, debates	fire,Mediterranean forest,periurban area,risk management	Bouisset Christine	2011-10-19	fr	1
23623	Baron M., Cunningham-Sabot E., Grasland C., Rivière D., Van Hamme G. (dir), 2010, <em>Villes et régions européennes en décroissance. Maintenir la cohésion territoriale</em>, Paris, Lavoisier, Série Aménagement et Gestion du territoire, 345 p.		Cottineau Clémentine	2011-04-29	fr	0
23603	Cities in Worldwide Air and Sea Flows: A multiple networks analysis	World cities system,Transport network,Air,Sea,Hierarchy,Gateway,réseau de transport,aérien,maritime,Gateway,hiérarchie,Système mondial des villes	Ducruet César,Ietri Daniele,Rozenblat Céline	2011-03-31	en	1
23625	Serigne Mansour Tall, 2009, <em>Investir dans la ville africaine - Les émigrés et l'habitat à Dakar</em>, Paris, Karthala, 286 p.		Choplin Armelle	2011-04-29	fr	0
23628	The Price of Freedom		Pumain Denise	2011-05-02	en	1
23733	Between heritage, tourism and agriculture: difficulty of a choice of management in a multifunctional space. Application to chinampas Xochimilco (Mexico).	management; multifunctionality; heritage; tourism; agriculture; Mexico City	Clauzel Céline	2011-05-27	fr	1
23630	Le prix de la liberté		Pumain Denise	2011-05-02	fr	0
23633	Pinson G., 2009, <em>Gouverner la ville par projet, urbanisme et gouvernance des villes européennes</em>, Presses de Science Po, Paris, 418 p.		Verdol Maïté	2011-05-04	fr	0
23634	Urban spatial structure, daily mobility and energy consumption: a study of 34 European cities	daily mobility,polycentricism,urban morphology,urban structure,urban sustainability	Le Néchet Florent	2011-05-18	fr	1
23637	Coastal wetlands aside from “the lure of the sea”? Their image in French painting and society since the XVIIIth century	geography,French painting,coastal zone,wetlands,perception	Goeldner-Gianella Lydie,Feiss-Jehel Corinne,Decroix Geneviève	2011-05-20	fr	1
23646	A study of the emergence of kinematic waves in targeted state car-following models of traffic	traffic,car-following model,linear stability analysis,emergence of kinematic waves,collective phenomenon	Tordeux Antoine,Lassarre Sylvain,Roussignol Michel	2011-05-23	en	1
23659	A study of the emergence of kinematic waves in targeted state car-following models of traffic	traffic,car-following model,linear stability analysis,emergence of kinematic waves,collective phenomenon	Tordeux Antoine,Lassarre Sylvain,Roussignol Michel	2011-05-23	en	1
23660	A study of the emergence of kinematic waves in targeted state car-following models of traffic	traffic,car-following model,linear stability analysis,emergence of kinematic waves,collective phenomenon	Tordeux Antoine,Lassarre Sylvain,Roussignol Michel	2011-05-23	en	1
23661	Spatial indicators for Ferlo’s pastoral transhumance	Ferlo,indicateurs,indicators,mobilité,mobility,pastoralism,pastoralisme,Sahel,Sénégal,transhumance	Leclerc Grégoire,Sy Oumar	2011-05-23	fr	1
23669	A Geography of Family in Southern Europe	epistemology,family,Greece,Italy,population geography,Portugal,social geography,southern europe,Spain,urban geography	Pfirsch Thomas	2011-05-25	fr	1
23707	New borders in Central Asia: the restructuring of states, nations and regions	border formation,borders,enclavement,Ferghana,Ferghana.,frontières,horogénèse,indépendance,independence,Kazakhstan,Kirghizstan,Kyrgyzstan,land-lockness,mobilités,mobility,networks,Ouzbékistan,post-Soviet transition,réseaux,Tadjikistan,Tajikistan,territorial transition,transformation post-soviétique,transition territoriale,Turkménistan,Turkmenistan,Uzbekistan	Thorez Julien	2011-05-25	fr	1
23782	Methods for mapping regional trends of HIV prevalence from Demographic and Health Surveys (DHS)	demographic and health surveys,developing countries,HIV,interpolation,kernel interpolation,methodology,regional trends	Larmarange Joseph,Vallo Roselyne,Yaro Seydou,Msellati Philippe,Méda Nicolas	2011-06-16	fr	1
24607	The tsunami in South-East Asia – a retrospective analysis of the management of an apocalyptic natural disaster	tsunami,natural risk,hazard,vulnerability,risk management,warning system,land use planning,education,south-east Asia	Ozer Pierre,Verdier Angéla,Longueville Florence de	2011-10-28	en	1
23763	Xynthia: lessons of a disaster	Xynthia,disaster,marine submersion,vulnerability,disaster remembrance,risk management	Chauveau Etienne,Chadenas Céline,Comentale Bruno,Pottier Patrick,Blanlœil Amandine,Feuillet Thierry,Mercier Denis,Pourinet Laurent,Rollo Nicolas,Tillier Ion,Trouillet Brice	2011-06-09	fr	1
23737	The thermal rehabilitation of the old buildings of Paris: how to conciliate protection of urban heritage and energetic performance?	urban heritage,energies,sustainable urban development,thermal rehabilitation,Paris	Ter Minassian Hovig	2011-05-30	fr	1
23745	The spatial dynamics of gentrification in Paris: a synthesis map	gentrification,spatial social divisions,spatial dynamics,pioneer frontier,cartography,working-class neighbourhoods,Paris	Clerval Anne,Verdier Angéla	2011-10-21	en	1
23751	Polar Shipping Seaways? An analysis of strategies from shipping firms in the Arctic	sea shipping and transportation,Arctic,Arctic routes,shipping,Northwest Passage,Northeast Passage,Northern Sea Route	Lasserre Frédéric	2011-05-31	fr	1
23808	Economic and Cultural Complexes of China	China,cluster,human geography,regionalization,methodology in geography	Krechetova Varvara	2011-06-23		0
23818	Slave work’s Geography in Brazil	labour force,slavery,cartography,Brazil	Théry Hervé,Mello Théry Neli Aparecida de,Girardi Eduardo,Hato Julio	2011-06-23	fr	1
26511	Territories and contracts for the Environment. The Lalangina region, on the western slope of the Ambositra Vondrozo forest corridor, Madagascar	Madagascar,forest corridor,environmental policy,payment for ecological services,provisions,territory,biodiversity,forest,local community,poverty	Rakoto Ramiarantsoa Hervé,Blanc-Pamard Chantal,Andriantseheno Dolys,Ramamonjy Haingo	2014-11-05	fr	1
23817	Marrakech, un mois plus tard, 10 ans après		Debarbieux Bernard	2011-06-23	fr	0
23825	An Evaluation of Road Network Patterns Based on the Criteria for Fire-Fighting	network analysis,road network,fire fighting	Usui Hiroyuki,Asami Yasushi	2011-06-29	en	1
23832	Land market and social space in Muscat, Oman	fragmentation,development,land estate,values,polarization,aggregation	Mokhtar Belgacem	2011-07-01	fr	1
23840	Living spaces and mobility practices of students in the East of Paris: dealing with proximities and dependence	centrality,dependence,living spaces,mobility,Paris,proximity,student	Choplin Armelle,Delage Matthieu	2011-07-01	fr	1
24071	Masboungi A. (dir.), 2010, Bien habiter la ville, Editions du Moniteur, Coll. Projet urbain, 175 p.		Boutouyrie Eric	2011-10-13	fr	0
24072	Johnston		Blidon Marianne	2011-10-13	fr	1
24168	Oriental Women and Commercial Photographers. The Construction of an Imaginary in the Photographic Production of the 1860’s through the 1880’s	eroticism,gender,imaginary,Orient,photography,women	Gauthier Lionel	2011-10-13	fr	1
24179	The extension of Hanoi’s administrative limits: Territorial restructuring in tension	Hanoi,land politics,real estate activities,territorial planning,Vietnam	Labbé Danielle,Musil Clément	2011-10-14	fr	1
24187	Malaria prevention in Gabon during colonization	colonization,Gabon,malaria,prevention	Ndonghan Iyangui Nadine N.,Clanet Jean-Charles,Kombila Maryvonne	2011-09-21	fr	1
