"TITLE";"ID";"YEAR";"CITCOM";"MODEL";"TYPE";"TEMPSCALE";"SPATSCALE";"METHODO";"EQU";"THEME";"CASE";"DISCIPLINE";"PROCESSES";"OBSERVATION";"LINK"
"Does the tunnel effect still remains in 2016?";"10738864039748889406";"2016";"2";"no";;;;;;;;"economics";;;
"Transport infrastructures and employment growth in the Paris metropolitan margins";"6584762621142783847";"2013";"3";"yes";"territory";"25";"metro";"stat";"NA";"economic growth";"Paris";"geography";;;
" Towards an Agent-based, Integrated Land-use Transport Modeling System";"6652958539764071087";"2016";"7";"yes";"territory";"NA";"region";"sim";"no";"luti";"US";"transportation";;;
" Interaction of rail infrastructure and urbanisation in the Netherlands; a preliminary analysis";"15413807339531757372";;"7";"no";;;;;;;;"geography";;;
"Un scénario tod pour la région nord-pas-de-calais. Enseignements d'une modélisation intégrée transport-usage du sol";"15529062511553929860";"2014";"7";"yes";"territory";"NA";"region";"sim";"no";"luti";"Nord";"planning";;;
"Distributive effects of new highway infrastructure in the Netherlands: the role of network effects and spatial spillovers";"911562600049741193";"2014";"8";"yes";"territory";"0";"metro";"map";"NA";"accessibility";"Netherlands";"geography";;;
"Trading between land use and transportation planning: the Kuopio model";"697217264262062284";"2013";"8";"hs";;;;;;;;"planning";;;
" The Difficult Relationship between Land Use Planning and Transport Planning: Evidences from the City of Turin, Italy";"3933277355105472665";"2011";"7";"hs";;;;;;;;"planning";;;
"Co-evolution of density and topology in a simple model of city formation";"5911724637352669367";;"12";"yes";"network";"NA";"metro";"sim";"no";"network growth";;"physics";;;
" Transport et développement des territoires";"10442182600286982584";;"3";"review";;;;;;;;"transportation";;;
"A multi-paradigm approach to system dynamics modeling of intercity transportation";"1503214211433720259";"2014";"12";"hs";;;;;;;;"transportation";;;
"Integrated land use and transportation interaction: a temporal GIS exploratory data analysis approach";"12472562146627614890";"2003";"7";"no";;;;;;;;"geography";;"no application";
" Injecting a rapid rail link into a metropolis";"15543094506723780834";"2010";"11";"no";;;;;;;;"planning";;;
"Modélisation de la dynamique des systèmes de peuplement: de SimpopLocal à SimpopNet.";"4314943395653192320";"2014";"5";"yes";"strong";"200";"country";"sim";"no";"coevolution";;"geography";;;
"Calibration of an integrated land-use and transportation model using maximum-likelihood estimation";"9299535133961645220";"2014";"7";"hs";;;;;;;;"computer science";;"calibration algo";
"Assessing the impacts of Light Rail Transit on urban land in Manila";"4840737556316235848";"2010";"8";"yes";"territory";"0";"local";"stat";"NA";"accessibility";"Manila";"transportation";;;
"Viewpoint: Toward a new generation of land use transport interaction models";"15723813718667706986";"2015";"7";"no";;;;;;;;"transportation";;;
" An investigation into the economic impacts on cities of investment in light rail systems";"10079022345894618592";"2014";"2";"no";;;;;;;;"economics";;;
" Transport link scanner: simulating geographic transport network expansion through individual investments";"4395795512842304969";"2016";"12";"yes";"network";"100";"country";"sim";"no";"network growth";"Netherlands";"geography";;;
"Integrated co-evolution model of land use and traffic network design";"2602998652949126134";"2016";"12";"yes";"strong";"NA";"metro";"sim";"no";"coevolution";;"economics";;;
"The coevolution of transport and land use: An introduction to the Special Issue and an outline of a research agenda";"16412613606761088373";"2011";"12";"no";;;;;;;;"transportation";;;
"The impact of railway station development on urban dynamics: A review of the Amsterdam South Axis project";"5072748012109513834";"2009";"11";"no";;;;;;;;"economics";;;
"Land Use-Transportation Interaction: Lessons Learned from an Experimental Model using Cellular Automata and Artificial Neural Networks";"5034596443416444562";"2008";"7";"yes";"territory";"15";"metro";"sim";"no";"luti";"US";"geography";;;
