"TITLE";"ID";"YEAR";"CITCOM";"MODEL";"TYPE";"TEMPSCALE";"SPATSCALE";"METHODO";"EQU";"THEME";"CASE";"DISCIPLINE";"PROCESSES";"OBSERVATION";"LINK"
"Analysis of the impact of high-speed railroad service on air transport demand";"2741168611238703427";"2006";"NA";"no";;;;"survey";;;;"transportation";;;
"Roads, land use, and deforestation: a spatial model applied to Belize";"10120413830864362824";"1996";"NA";"yes";"territory";"NA";"country";"stat";"NA";"sustainibility";"Belize";"economics";"market,luc";;
"Spatiotemporal urbanization processes in the megacity of Mumbai, India: A Markov chains-cellular automata urban growth model";"5526883927689977429";"2013";"NA";"yes";"territory";"50";"metro";"ca";"no";"urban growth";"Mumbai";"geography";"luc";;
"Analyse économique des configurations urbaines et de leur étalement";"4261196624544641724";"2000";"NA";"yes";"territory";"25";"metro";"stat";"NA";"urban growth";"stat";"economics";"micro-eco,transport cost,market,amenities";;
"Modeling the spatial dynamics of regional land use: the CLUE-S model";"11472243155749927644";"2002";"NA";"yes";"territory";"25";"region";"ca";"no";"sustainibility";"Philippines, Malaysia";"environment";"luc";;
"Modelling the joint access mode and railway station choice";"7836108439721214640";"2009";"NA";"hs";;;;;;;;"transportation";;;
"Why do the poor live in cities? The role of public transportation";"4592975781722496335";"2008";"NA";"hs";;;;;;;;"economics";;;
" Handbook of regional and urban economics: cities and geography";"12440628822469350927";"2004";"NA";"hs";;;;;;;;"economics";;;
"Modeling urban expansion scenarios by coupling cellular automata model and system dynamic model in Beijing, China";"5280571749216175921";"2006";"NA";"yes";"territory";"30";"metro";"ca,systemdynamics";"no";"urban growth";"Beijing";"geography";"luc";;
" Ecogenèse territoriale et territorialité";"17145424911259202104";"1986";"NA";"no";;;;;;;;"geography";;;
"Alternative transportation modes in an urban land use model: a general equilibrium approach";"3165364121707577821";"1979";"NA";"yes";"network";"0";"metro";"eq";"yes";"transportation";"stat";"economics";"transportation demand";;
"The land use and transit connection in Toronto: Some lessons for Australian cities";"2456603338811174337";"1991";"NA";"no";;;;;;;;"planning";;;
"Can the high speed rail reinforce tourism attractiveness? The case of the high speed rail between Perpignan (France) and Barcelona (Spain)";"12567231728166421187";"2009";"NA";"yes";"territory";"20";"region";"eq";"yes";"hsr";"Perpignan";"economics";"agglomeration,dispersion";;
"The effects of urban spatial structure on travel demand in the United States";"8979905650138042379";"2005";"NA";"hs";;;;;;;;"economics";"urban form";;
"Multiple criteria decision-making techniques and their applications–a review of the literature from 2000 to 2014";"1709037592918865759";"2015";"NA";"hs";;;;;;;;"economics";"decision making";;
"Do plans matter? The effects of light rail plans on land values in station areas";"5893033290987527886";"2001";"NA";"yes";"territory";"5";"metro";"stat";"NA";"tod";"Oregon";"planning";"land value";;
"Reducing energy consumption through trajectory optimization for a metro network";"9996518109486866181";"1975";"NA";"hs";;;;;;;;"engineering";;;
"An integrated model of facility location and transportation network design";"13527409584934730161";"2001";"NA";"hs";;"NA";"NA";"ro";"no";"network design";"abstract";"transportation";;"Co-design network/facility";
"Accessibility evaluation of land-use and transport strategies: review and research directions";"14903997275377177864";"2004";"NA";"no";;;;;;"accessibility";;"geography";"accessiblity";"compares measures";
"Current operational urban land‐use–transport modelling frameworks: A review";"17564692245329390408";"2005";"NA";"review";;;;;;"luti";;"transportation";;;
"Urban form and travel behaviour: micro-level household attributes and residential context";"6816438350432176732";"2002";"NA";"hs";;;;;;;;"economics";;;
"A TOD planning model to review the regulation of allowable development densities around subway stations";"17412736314612590072";"2006";"NA";"yes";"territory";"NA";"local";"ro";;"tod";"Taipei";"planning";"density regulation";;
"A study of on integrated intercity travel demand model";"9428224722855847242";"2005";"NA";"hs";;;;;;;;"transportation";;;
"Evolution of the transit-oriented development model for low-density cities: a case study of Perth's new railway corridor";"18352831680500291924";"2008";"NA";"no";;;;;;"tod";"Perth";"planning";;;
"Transport networks and spatial choices: A European perspective";"5327509358687884035";"2007";"NA";"hs";;;;;;;;"transportation";;;
"Network design and transportation planning: Models and algorithms";"13527193772942453318";"1984";"NA";"hs";;;;;;"network design";;"transportation";;;
"Transportation and Land Use";"8660477253315319284";"2007";"NA";"no";;;;;;;;"geography";;"conceptual";
"Light rail proximity: Benefit or detriment in the case of Santa Clara County, California?";"6642187910472493264";"2001";"NA";"yes";"territory";"NA";"region";"stat";"NA";"housing market";"Santa Clara";"transportation";"housing market";;
" A land-use/transport interaction model for Austria";"12023503774881923572";"2009";"NA";"yes";"territory";"30";"country";"sim";"no";"luti";"Austria";"transportation";"active relocation,employment relocation,housing market";;
"A coverage model for improving public transit system accessibility and expanding access";"7714873155324269506";"2003";"NA";"hs";;;;;;;;"transportation";;;
"On the development of raem: The dutch spatial general equilibrium model and it's first application to a new railway link";"14419148078104479576";"2001";"NA";"yes";"territory";"20";"region";"eq";"yes";"transportation";"Amsterdam";"economics";"market,monopolistic competition";;
"Measuring territorial cohesion impacts of High-Speed Rail at different planning levels";"11015756863966592631";"2010";"NA";"hs";;;;;;"hsr";;"economics";;;
" The effect of infrastructure on long run economic growth";"18091431345429858831";"2004";"NA";"yes";"territory";"50";"country";"stat";"NA";"economic growth";"stat";"economics";"economic growth";;
"Rail transit and joint development: Land market impacts in Washington, DC and Atlanta";"17274035543169056854";"1994";"NA";"yes";"territory";"10";"local";"stat";"NA";"office market";"Washington, Atlanta";"planning";;;
" The saga of integrated land use-transport modeling: how many more dreams before we wake up?";"17733260940907186980";"2003";"NA";"no";;;;;;;;"transportation";;;
"La Performance territoriale des réseaux de transport";"14348395245465787968";"1997";"NA";"no";;;;;;;;"geography";;;
"Infrastructure, long‐run economic growth and causality tests for cointegrated panels";"3411011351715304243";"2008";"NA";"yes";"territory";"50";"country";"stat";"NA";"economic growth";;"economics";"economic growth";;
"The connection between public transit and employment: the cases of Portland and Atlanta";"9782602539524643904";"1999";"NA";"yes";"territory";"10";"local";"stat";"NA";;"Washington, Atlanta";"economics";"employment";;
"Multiple‐criteria decision support system in highway infrastructure management";"9673759713056410648";"2008";"NA";"hs";;;;;;;;"transportation";"decision making";;
"Does high-speed rail accessibility influence residential property prices? Hedonic estimates from southern Taiwan";"7207311748950739271";"2010";"NA";"yes";"territory";"0";"region";"stat";"NA";"hsr";"Taiwan";"transportation";"housing market";;
"Transit-oriented land planning model considering sustainability of mass rail transit";"2024160217331154543";"2010";"NA";"yes";"territory";"0";"local";"ro";"NA";"sustainibility";"Shenzhen";"planning";;;
"High speed rail: implication for cities";"18210480312465665176";"2012";"NA";"hs";;;;;;"hsr";;"transportation";;;
"Impact of rapid transit on suburban residential property values and land development";"10362761944235665290";"1972";"NA";"no";;;;;;"land development";;"economics";;;
"An application of an integrated transport network–multiregional CGE model: a framework for the economic analysis of highway projects";"7946482934883538573";"2004";"NA";"yes";"territory";"0";"country";"eq";"yes";"transportation";"South Korea";"economics";;;
" Aménagement du territoire et utilisation du sol";"16967190880366879666";"1984";"NA";"hs";;;;;;;;"geography";;;
"A unifying modelling framework to simulate the Spatial Economic Transport Interaction process at urban and national scales";"8447436889705718760";"2012";"NA";"yes";"strong";"NA";"country";"eq";"NA";;;"economics";;"conceptual";
" Les territoires du tramway moderne: de la ligne à la ville durable";"10809851577547721507";"2005";"NA";"hs";;;;;;;;"geography";;;
"Light-rail-transit impacts in Portland: The first ten years";"13938663556136217211";"1999";"NA";"yes";"territory";"10";"local";"stat";"NA";;"Portland";"economics";"active relocation";;
"LUTI model for the metropolitan area of Santander";"11426798802384056706";"2013";"NA";"yes";"territory";"NA";"metro";"sim,stat";"yes";"luti";"Santander";"planning";"transportation policy";;
"How accessibility shapes land use";"15575741556156415962";"1959";"NA";"yes";"territory";"NA";"metro";"eq";"no";;;"planning";"accessiblity";;
"Territorial cohesion impacts of high-speed rail at different planning levels";"2882196390170800133";"2012";"NA";"yes";"territory";"15";"country";"map";"NA";"hsr";"Spain";"geography";"accessiblity,territorial cohesion";;
"Transit's value-added effects: light and commuter rail services and commercial land values";"6684170136495887910";"2002";"NA";"yes";"territory";"0";"local";"stat";"NA";"transportation";"Santa Clara";"economics";"housing market";;
"Optimal Land Use—Transport Strategies: Methodology and Application to European Cities";"9935339511624817265";"2005";"NA";"no";;;;;;;;"transportation";;;
"Rules for biologically inspired adaptive network design";"17893242022307076992";"2010";"NA";"yes";"network";"NA";"metro";"sim";"no";"transportation";"Tokyo";"biology";"network growth";;
"The land-use impacts of urban rail transit systems";"14078813764339021668";"1996";"NA";"review";;;;;;;;"planning";;;
"Calibrating the Naples land-use and transport model";"4797711363877193555";"1994";"NA";"yes";"territory";"NA";"metro";"stat,ml,sim";"no";"luti";"Naples";"planning";;;
" Commercial Property Values and Proximity to Light Rail: Calculating Benefits with a Hedonic Price Model";"5195046070265209607";;"NA";"yes";"territory";"0";"local";"stat";"NA";"housing market";;"economics";"housing market";;
"Bus rapid transit impacts on land uses and land values in Seoul, Korea";"1786504861447836048";"2011";"NA";"yes";"territory";"0";"metro";"stat";"NA";"housing market";"Seoul";"transportation";"housing market";;
"Combined impacts of highways and light rail transit on residential property values: A spatial hedonic price model for Phoenix, Arizona";"4911806436491011149";"2014";"NA";"yes";"territory";"0";"metro";"stat";"NA";"housing market";"Phoenix";"geography";"housing market";;"http://www.sciencedirect.com/science/article/pii/S0966692314001653"
" The strategic, dynamic and integrated urban land use and transport model MARS (Metropolitan Activity Relocation Simulator)";"13172227782021916588";"2003";"NA";"yes";"territory";"20";"metro";"sim";"no";"luti";"Vienna";"planning";"active relocation,employment relocation,housing market";;"http://www.ivv.tuwien.ac.at/fileadmin/mediapool-verkehrsplanung/Diverse/Forschung/Publikationen/Online/MARS_smallest_size.pdf"
"Accessibility modeling and evaluation: The TIGRIS XL land-use and transport interaction model for the Netherlands";"13076030584230478433";"2015";"NA";"yes";"territory";"20";"region";"sim,stat";"no";"luti";"Netherlands";"planning";"relocation,accessibility,transport demand";;"http://www.sciencedirect.com/science/article/pii/S0198971514000647"
"Land-use/transport interaction models: Past and future";"9333134823238281996";"1998";"NA";"hs";;;;;;;;"planning";;;
"Multiagent land-use and transport model for the policy evaluation of a compact city";"14256171076146454580";"2005";"NA";"yes";"territory";"NA";"metro";"mas";"no";"sustainibility";;"planning";"relocation";;
"Measuring regional cohesion effects of large-scale transport infrastructure investments: an accessibility approach";"15923103254121616546";"2008";"NA";"yes";"territory";"10";"region";"map";"NA";"accessibility";"Spain";"planning";"accessiblity";;"http://www.tandfonline.com/doi/abs/10.1080/09654310701814629?journalCode=ceps20"
"Impacts on accessibility of China's present and future HSR network";"1497411548457644019";"2014";"NA";"yes";"territory";"10";"country";"map";"NA";"hsr";"China";"geography";"accessiblity";;"http://www.sciencedirect.com/science/article/pii/S0966692314001525"
" Evaluating transit-oriented development using a sustainability framework: Lessons from Perth's network city";"1874975002961414310";"2009";"NA";"hs";;;;;;;;"planning";;;
"The impact of transit-oriented development on housing prices in San Diego, CA";"3443722888458689953";"2011";"NA";"yes";"territory";"0";"metro";"stat";"NA";"housing market";"San Diego";"economics";"housing market";;
"Impact of proximity to light rail rapid transit on station-area property values in Buffalo, New York";"2184418343986277380";"2007";"NA";"yes";"territory";"0";"local";"stat";"NA";"housing market";"Buffalo";"economics";"housing market";;
"Overview of land use transport models";"3647216975258379343";"2004";"NA";"review";;;;;;;;"planning";;;
" Territorial implications of high speed rail: a Spanish perspective";"7238773654311666897";"2016";"NA";"hs";;;;;;;;"transportation";;;
"Relationship between transport accessibility and land value: Local model approach with geographically weighted regression";"4418397137131889429";"2006";"NA";"yes";"territory";"0";"local";"stat";"NA";"housing market";"UK";"economics";"housing market";;"https://trid.trb.org/view.aspx?id=777211"
"Assessing the accessibility impact of transport policy by a land-use and transport interaction model–The case of Madrid";"7403034735160752310";"2015";"NA";"yes";"territory";"0";"metro";"sim,stat";"no";"luti";"Madrid";"planning";;;"http://www.sciencedirect.com/science/article/pii/S019897151400043X"
"Linking urban transport and land use in developing countries";"581933628528961027";"2013";"NA";"no";;;;;;;;"planning";;;"https://www.jtlu.org/index.php/jtlu/article/view/425"
"Measuring the neighborhood benefits of rail transit accessibility";"4393706071311534606";"1997";"NA";"yes";"territory";"0";"local";"stat";"NA";"housing market";;"economics";"housing market";;"https://trid.trb.org/view.aspx?id=578169"
" Towards a land use and transport interaction framework";"1710252771559171104";"2000";"NA";"no";;;;;;;;"planning";;;
"A physarum network evolution model based on IBTM";"16487236950183891908";"2013";"NA";"hs";;;;;;;;"biology";;;
"A GIS‐based land use and public transport accessibility indexing model";"12077705089835878954";"2007";"NA";"yes";"territory";"NA";"metro";"stat";"NA";"accessibility";;"planning";"accessiblity";;
"The role of the transport system in destination development";"1650848833307333103";"2000";"NA";"hs";;;;;;;;"geography";;"tourism";
" The impact of railway stations on residential and commercial property value: a meta-analysis";"13445798032165848396";"2007";"NA";"review";;;;;;;;"economics";;;
"Integrated urban models for simulation of transit and land-use policies";"3781617263417430270";"1998";"NA";"hs";;;;;;;;"planning";;"guidelines";
"Urban concentration: the role of increasing returns and transport costs";"18272623801279535261";"1996";"NA";"no";;;;;;;;"economics";;;
"Reaction of house prices to a new rapid transit line: Chicago's midway line, 1983–1999";"2016332858113242291";"2004";"NA";"yes";"territory";"20";"metro";"stat";"NA";"housing market";"Chicago";"economics";"housing market";;
" LUTI modelling in the Netherlands: Experiences with TIGRIS and a framework for a new LUTI model";"12775946050966369604";"2004";"NA";"yes";"territory";"NA";"region";"sim";"no";"luti";"Netherlands";"planning";;;
" Modèles d'intégration spatiale et réseau des villes en Europe occidentale";"14436860538273457118";"1998";"NA";"hs";;;;;;;;"geography";;;"http://www.persee.fr/doc/spgeo_0046-2497_1998_num_27_1_1117"
"Transport planning with multiple criteria: the analytic hierarchy process applications and progress review";"14117261840986233099";"1995";"NA";"hs";;;;;;;;"transportation";;;
"Multiregional model with endogenous price system for evaluating road construction projects";"8323240285143884679";"1987";"NA";"yes";"territory";"NA";"country";"eq";"yes";"transportation";;"economics";;;
" Modeling long-range transportation and land use scenarios for the Sacramento region, using citizen-generated policies";"16243496654184230401";"2008";"NA";"yes";"territory";"50";"region";"sim";"no";"luti";"Sacramento";"planning";;;
"Transit-oriented development in San Diego County: The incremental implementation of a planning idea";"2711632327760691846";"1999";"NA";"no";;;;;;;;"planning";;;
"Chinese edition of transit-oriented development";"14424316244410372379";"2007";"NA";"hs";;;;;;;;"planning";;;
"UrbanSim: Modeling urban development for land use, transportation, and environmental planning";"10961332031865325758";"2002";"NA";"yes";"territory";"20";"metro";"sim";"no";"luti";"Oregon";"planning";;;
"Applied models of urban land use, transport and environment: state of the art and future developments";"6377202254643625039";"1998";"NA";"review";;;;;;;;"planning";;;
"Railway station site selection using analytical hierarchy process and data envelopment analysis";"9937513993046226542";"2010";"NA";"yes";"network";"0";"metro";"ro";"NA";"network design";"Iran";"engineering";;;"http://www.sciencedirect.com/science/article/pii/S036083521000077X"
"Leeds Integrated Land-Use Transport Model (LILT)";"17246353187156135543";"1983";"NA";"yes";"territory";"NA";"metro";"sim";"no";"luti";"Leeds";"planning";;"Both-way interaction : network supply only, no infra";
"MASTER model (micro-analytical simulation of transport, employment and residence)";"15933226690278854311";"1990";"NA";"yes";"territory";"NA";"metro";"sim";"no";"luti";;"planning";;;
"Effects of urban rail transit expansions: Evidence from sixteen cities, 1970-2000 ";"14049005034234653393";"2005";"NA";"review";;;;;;;;"economics";;;
"Capitalization of BRT network expansions effects into prices of non-expansion areas";"14930612208324155397";"2009";"NA";"yes";"territory";"0";"metro";"stat";"NA";"housing market";"Bogota";"transportation";;;"http://www.sciencedirect.com/science/article/pii/S0965856409000299"
" Future forms and design for sustainable cities";"2370741951161166355";"2005";"NA";"no";;;;;;;;"planning";;;
"Redistributive effects of bus rapid transit (BRT) on development patterns and property values in Seoul, Korea";"2765907686933992521";"2012";"NA";"yes";"territory";"0";"metro";"sim";"no";"luti";"Seoul";"transportation";;;
"L'évolution des villes dans l'espace post-soviétique. Observation et modélisations.";"1307757021320289647";"2014";"NA";"hs";;;;;;;;"geography";;;
"Comparing the output of cost benefit and multi-criteria analysis: An application to urban transport investments";"11119730724381419043";"2006";"NA";"hs";;;;;;;;"transportation";;;
"Is investment in high speed rail socially profitable?";"8971822581675494264";"2007";"NA";"hs";;;;;;;;"transportation";;;
"Territorial cohesion impacts of high-speed rail under different zoning systems";"1194486642962524679";"2014";"NA";"yes";"territory";"0";"region";"map";"NA";"hsr";"Spain";"transportation";;;
"Infrastructure, geographical disadvantage, transport costs, and trade";"3890467767525018910";"2001";"NA";"hs";;;;;;;;"economics";;;
"The multi‐actor, multi‐criteria analysis methodology (MAMCA) for the evaluation of transport projects: Theory and practice";"16783901319221212720";"2009";"NA";"hs";;;;;;;;"transportation";;;
"Development of a temporal and spatial linkage between transit demand and land-use patterns";"8612868363866879140";"2013";"NA";"hs";;;;;;;;"transportation";;;
"Les interactions entre système de transport et système de localisation en milieu urbain et leur modélisation";"13649329046387955180";"2000";"NA";"yes";"territory";"NA";"metro";"eq";"no";;;"economics";;;
" Conception d'un automate cellulaire non stationnaire à base de graphe pour modéliser la structure spatiale urbaine: le modèle Remus";"2246124274659537904";"2007";"NA";"hs";;;;;;;;"geography";;;
" Using transport models in spatial planning: issues from a review of the London land-use/transport interaction (LUTI) Model";"15843773653490207398";"2009";"NA";"no";;;;;;;;"transportation";;;
"The impact of rapid rail transit on economic development: the case of Atlanta's MARTA";"16217335523035094026";"1997";"NA";"yes";"territory";"0";"local";"stat";"NA";"transportation";"Atlanta";"economics";;;
"Identifying the impacts of rail transit stations on residential property values";"13588936307863952369";"2001";"NA";"yes";"territory";"0";"local";"stat";"NA";"transportation";"Atlanta";"economics";;;"http://www.sciencedirect.com/science/article/pii/S0094119001922144"
" Spatial economic impacts of transport infrastructure investments";"4099685160755234978";"2003";"NA";"no";;;;;;;;"planning";;;
"Equip the warrior instead of manning the equipment: Land use and transport planning support in the Netherlands";"6569546468110646686";"2010";"NA";"no";;;;;;;;"planning";;"planning practice";
"The effects of a new subway line on housing prices in metropolitan Toronto";"13974757598491717610";"1983";"NA";"yes";"territory";"0";"metro";"stat";"NA";"transportation";"Toronto";"economics";;;
"UPlan: a versatile urban growth model for transportation planning";"4923914250704461164";"2003";"NA";"hs";;;;;;;;"planning";;;
"A cellular automata-based land use and transport interaction model applied to Jeddah, Saudi Arabia";"16063744230424344758";"2013";"NA";"yes";"territory";"NA";"metro";"ca";"no";"luti";"Jeddah";"planning";;;
"High-speed rail transit impact on regional systems: does the Shinkansen contribute to dispersion?";"16105698267676210807";"1997";"NA";"yes";"territory";"0";"region";"stat";"NA";"hsr";"Japan";"geography";;;
"Sustainable accessibility: a conceptual framework to integrate transport and land use plan-making. Two test-applications in the Netherlands and a reflection on the …";"7327262770207639336";"2005";"NA";"no";;;;;;;;"transportation";;;
"Developing transit-oriented corridors: Insights from Tokyo";"16163531430831005128";"2016";"NA";"no";;;;;;;;"transportation";;;
" Urban Land-use and Transport Interaction: Policies and Models. Report of the International Study Group on Land-use/Transport Interaction (ISGLUTI)";"6724525399354672343";"1988";"NA";"hs";;;;;;;;"transportation";;;
"Integration of Sustainability Issues in Strategic Transportation Planning: A Multi‐criteria Model for the Assessment of Transport Infrastructure Plans";"3038785531340906362";"2010";"NA";"hs";;;;;;;;"engineering";;;
" Developing a sustainability assessment model: the sustainable infrastructure, land-use, environment and transport model";"10547017315451312407";"2010";"NA";"hs";;;;;;;;"planning";;;
"Regional polycentricity: an indicator framework for assessing cohesion impacts of railway infrastructures";"11351703448754345746";"2016";"NA";"hs";;;;;;;;"planning";;;
" Land-use/transport interaction models as tools for sustainability impact assessment of transport investments: review and research perspectives";"3718057397341599920";"2004";"NA";"review";;;;;;;;"planning";;;
"Land-use transport interaction: state of the art";"16732332007051269037";"2004";"NA";"review";;;;;;;;"planning";;;
"Accessibility Impact of the Suburbanization of High-Speed Rail Stations in China";"1261624366439909540";"2015";"NA";"hs";;;;;;;;"transportation";;;
"High-speed rail and office location choices. A stated choice experiment for the Netherlands";"10281642940978705087";"2011";"NA";"yes";"territory";"0";"country";"stat";"NA";"hsr";"Netherlands";"geography";;;
" Towards the 5-stage land use-transport model";"11703662531117932857";"1993";"NA";"no";;;;;;;;"planning";;;
"Spatial development patterns and public transport: the application of an analytical model in the Netherlands";"1728787302865949564";"1999";"NA";"yes";"territory";"NA";"country";"eq";;;"Netherlands";"planning";;;
"Access: the transport-land use economic link";"3714490189766789671";"1995";"NA";"no";;;;;;;;"transportation";;;
" Integrated land use and transport modelling. Decision chains and hierarchies";"17928749455960355096";"1989";"NA";"no";;;;;;;;"transportation";;;
"Infrastructure in a structural model of economic growth";"12578455509705156720";"1995";"NA";"yes";"territory";"NA";"country";"eq";"yes";"economic growth";;"economics";;;
"A GIS-based planning approach to locating urban rail terminals";"9922981368373927992";"2001";"NA";"yes";"network";"0";"region";"stat";"NA";"network design";"Ohio";"transportation";;;
"Transit transformations: private financing and sustainable urbanism in Hong Kong and Tokyo";"11225450266381394618";"2010";"NA";"no";;;;;;;;"planning";;;
"Integrated land use-transport model system with dynamic time-dependent activity-travel microsimulation";"14847883086865730751";"2012";"NA";"yes";"territory";"NA";"metro";"sim";"no";"luti";;"transportation";;;
"Introduction to the special issue The regional and urban effects of high-speed trains";"11113342855832408846";"1997";"NA";"no";;;;;;;;"transportation";;;
" A micro-simulator of urban land use dynamics integrating a multi-agent model of land development and an activity-based model of transport demand";"8457668460887267734";"2004";"7";"yes";"territory";"NA";"metro";"mas";"no";"luti";;"planning";;;
